{
  "$schema": "https://json-schema.org/draft/2020-12/schema",
  "$id": "https://oppw4.tools/schemas/character.schema.json",
  "title": "OPPW4 Character",
  "type": "object",
  "additionalProperties": false,
  "required": ["id", "display_name", "aliases", "ids", "assets"],
  "properties": {
    "$schema": {
      "type": "string"
    },
    "id": {
      "type": "string",
      "pattern": "^[a-z0-9_][a-z0-9_-]*$"
    },
    "display_name": {
      "type": "string",
      "minLength": 1
    },
    "aliases": {
      "type": "array",
      "items": {
        "type": "string",
        "minLength": 1
      },
      "uniqueItems": true
    },
    "ids": {
      "type": "object",
      "additionalProperties": false,
      "required": ["playable", "runtime", "boss_runtime", "model"],
      "properties": {
        "playable": {
          "$ref": "#/$defs/nullable_u16"
        },
        "runtime": {
          "$ref": "#/$defs/nullable_u16"
        },
        "boss_runtime": {
          "$ref": "#/$defs/nullable_u16"
        },
        "model": {
          "$ref": "#/$defs/nullable_u16"
        }
      }
    },
    "assets": {
      "type": "object",
      "additionalProperties": false,
      "required": ["costumes"],
      "properties": {
        "costumes": {
          "type": "array",
          "items": {
            "type": "object",
            "additionalProperties": false,
            "required": ["id", "ref"],
            "properties": {
              "id": {
                "type": "string",
                "pattern": "^[a-z0-9_][a-z0-9_-]*$"
              },
              "ref": {
                "type": "string",
                "pattern": "^costumes/[a-z0-9_][a-z0-9_-]*\\.json$"
              }
            }
          }
        }
      }
    },
    "movesets": {
      "type": "object",
      "additionalProperties": false,
      "required": ["ref"],
      "properties": {
        "ref": {
          "type": "string",
          "const": "movesets.json"
        }
      }
    },
    "notes": {
      "type": "array",
      "items": {
        "type": "string"
      }
    }
  },
  "$defs": {
    "nullable_u16": {
      "type": ["integer", "null"],
      "minimum": 0,
      "maximum": 65535
    }
  }
}
