{
  "$schema": "../../schemas/character.schema.json",
  "id": "sanji",
  "display_name": "Sanji",
  "aliases": [],
  "ids": {
    "playable": 4,
    "runtime": 4,
    "boss_runtime": 4,
    "model": 4
  },
  "notes": [],
  "assets": {
    "costumes": [
      {
        "id": "default",
        "ref": "costumes/default.json"
      }
    ]
  },
  "movesets": {
    "ref": "movesets.json"
  }
}
