{
  "$schema": "../../schemas/character.schema.json",
  "id": "jabra",
  "display_name": "Jabra",
  "aliases": [],
  "ids": {
    "playable": 52,
    "runtime": 108,
    "boss_runtime": 82,
    "model": 59
  },
  "notes": [],
  "assets": {
    "costumes": [
      {
        "id": "default",
        "ref": "costumes/default.json"
      }
    ]
  }
}
