{
  "$schema": "../../schemas/character.schema.json",
  "id": "killer",
  "display_name": "Killer",
  "aliases": [],
  "ids": {
    "playable": 160,
    "runtime": 64,
    "boss_runtime": 283,
    "model": 285
  },
  "notes": [],
  "assets": {
    "costumes": [
      {
        "id": "default",
        "ref": "costumes/default.json"
      }
    ]
  }
}
