{
  "$schema": "../../schemas/character.schema.json",
  "id": "perospero",
  "display_name": "Perospero",
  "aliases": [],
  "ids": {
    "playable": 68,
    "runtime": 141,
    "boss_runtime": 108,
    "model": 92
  },
  "notes": [],
  "assets": {
    "costumes": [
      {
        "id": "default",
        "ref": "costumes/default.json"
      }
    ]
  }
}
