{
  "$schema": "../../schemas/character.schema.json",
  "id": "pacifista",
  "display_name": "Pacifista",
  "aliases": [],
  "ids": {
    "playable": 55,
    "runtime": 111,
    "boss_runtime": 85,
    "model": 62
  },
  "notes": [],
  "assets": {
    "costumes": [
      {
        "id": "default",
        "ref": "costumes/default.json"
      }
    ]
  }
}
