{
  "$schema": "../../schemas/character.schema.json",
  "id": "marco",
  "display_name": "Marco",
  "aliases": [],
  "ids": {
    "playable": 21,
    "runtime": 24,
    "boss_runtime": 24,
    "model": 24
  },
  "notes": [],
  "assets": {
    "costumes": [
      {
        "id": "default",
        "ref": "costumes/default.json"
      }
    ]
  },
  "movesets": {
    "ref": "movesets.json"
  }
}
