{
  "$schema": "../../schemas/character.schema.json",
  "id": "eneru_th_b",
  "display_name": "Eneru Thunder Black",
  "aliases": [
    "enel_thunder_black"
  ],
  "ids": {
    "playable": 192,
    "runtime": null,
    "boss_runtime": null,
    "model": 324
  },
  "notes": [],
  "assets": {
    "costumes": [
      {
        "id": "default",
        "ref": "costumes/default.json"
      }
    ]
  }
}
