{
  "$schema": "../../schemas/character.schema.json",
  "id": "reiju",
  "display_name": "Reiju",
  "aliases": [],
  "ids": {
    "playable": 33,
    "runtime": 41,
    "boss_runtime": 41,
    "model": 41
  },
  "notes": [],
  "assets": {
    "costumes": [
      {
        "id": "default",
        "ref": "costumes/default.json"
      }
    ]
  }
}
