{
  "$schema": "../../schemas/character.schema.json",
  "id": "bonney_egh",
  "display_name": "Bonney",
  "aliases": [
    "bonney"
  ],
  "ids": {
    "playable": 184,
    "runtime": null,
    "boss_runtime": null,
    "model": 314
  },
  "notes": [],
  "assets": {
    "costumes": [
      {
        "id": "default",
        "ref": "costumes/default.json"
      }
    ]
  }
}
