{
  "$schema": "../../schemas/character.schema.json",
  "id": "bartolomeo",
  "display_name": "Bartolomeo",
  "aliases": [],
  "ids": {
    "playable": 30,
    "runtime": 37,
    "boss_runtime": 37,
    "model": 37
  },
  "notes": [],
  "assets": {
    "costumes": [
      {
        "id": "default",
        "ref": "costumes/default.json"
      }
    ]
  }
}
