{
  "$schema": "../../schemas/character.schema.json",
  "id": "eneru_d",
  "display_name": "Eneru Divine",
  "aliases": [
    "eneru",
    "enel"
  ],
  "ids": {
    "playable": 190,
    "runtime": null,
    "boss_runtime": null,
    "model": 322
  },
  "notes": [],
  "assets": {
    "costumes": [
      {
        "id": "default",
        "ref": "costumes/default.json"
      }
    ]
  }
}
