{
  "$schema": "../../schemas/character.schema.json",
  "id": "fujitora",
  "display_name": "Fujitora",
  "aliases": [],
  "ids": {
    "playable": 25,
    "runtime": 30,
    "boss_runtime": 30,
    "model": 30
  },
  "notes": [],
  "assets": {
    "costumes": [
      {
        "id": "default",
        "ref": "costumes/default.json"
      }
    ]
  }
}
