{
  "$schema": "../../schemas/character.schema.json",
  "id": "garp_yng",
  "display_name": "Monkey D. Garp (Young)",
  "aliases": [
    "young_garp"
  ],
  "ids": {
    "playable": 179,
    "runtime": 76,
    "boss_runtime": 25,
    "model": 304
  },
  "notes": [],
  "assets": {
    "costumes": [
      {
        "id": "default",
        "ref": "costumes/default.json"
      }
    ]
  }
}
