{
  "$schema": "../../schemas/character.schema.json",
  "id": "drake_chg",
  "display_name": "Drake Chg",
  "aliases": [],
  "ids": {
    "playable": 159,
    "runtime": null,
    "boss_runtime": null,
    "model": 290
  },
  "notes": [],
  "assets": {
    "costumes": [
      {
        "id": "default",
        "ref": "costumes/default.json"
      }
    ]
  }
}
