{
  "$schema": "../../schemas/character.schema.json",
  "id": "yamato_s",
  "display_name": "Yamato S",
  "aliases": [],
  "ids": {
    "playable": 173,
    "runtime": null,
    "boss_runtime": null,
    "model": 307
  },
  "notes": [],
  "assets": {
    "costumes": [
      {
        "id": "default",
        "ref": "costumes/default.json"
      }
    ]
  }
}
