{
  "$schema": "../../schemas/character.schema.json",
  "id": "bonney_g",
  "display_name": "Bonney Gear",
  "aliases": [
    "bonney_gear"
  ],
  "ids": {
    "playable": 185,
    "runtime": null,
    "boss_runtime": null,
    "model": 316
  },
  "notes": [],
  "assets": {
    "costumes": [
      {
        "id": "default",
        "ref": "costumes/default.json"
      }
    ]
  }
}
