{
  "$schema": "../../schemas/character.schema.json",
  "id": "luffy_snakeman",
  "display_name": "Monkey D. Luffy Snakeman",
  "aliases": [
    "snakeman",
    "luffy_snake_man"
  ],
  "ids": {
    "playable": null,
    "runtime": null,
    "boss_runtime": null,
    "model": null
  },
  "notes": [],
  "assets": {
    "costumes": [
      {
        "id": "default",
        "ref": "costumes/default.json"
      }
    ]
  },
  "movesets": {
    "ref": "movesets.json"
  }
}
