{
  "$schema": "../../schemas/character.schema.json",
  "id": "brook",
  "display_name": "Brook",
  "aliases": [],
  "ids": {
    "playable": 8,
    "runtime": 8,
    "boss_runtime": 8,
    "model": 8
  },
  "notes": [],
  "assets": {
    "costumes": [
      {
        "id": "default",
        "ref": "costumes/default.json"
      }
    ]
  }
}
