{
  "$schema": "../../schemas/character.schema.json",
  "id": "crocodile",
  "display_name": "Crocodile",
  "aliases": [],
  "ids": {
    "playable": 15,
    "runtime": 15,
    "boss_runtime": 15,
    "model": 15
  },
  "notes": [],
  "assets": {
    "costumes": [
      {
        "id": "default",
        "ref": "costumes/default.json"
      }
    ]
  }
}
