{
  "$schema": "../../schemas/character.schema.json",
  "id": "franky",
  "display_name": "Franky",
  "aliases": [],
  "ids": {
    "playable": 7,
    "runtime": 7,
    "boss_runtime": 7,
    "model": 7
  },
  "notes": [],
  "assets": {
    "costumes": [
      {
        "id": "default",
        "ref": "costumes/default.json"
      }
    ]
  }
}
