{
  "$schema": "../../schemas/character.schema.json",
  "id": "kaido",
  "display_name": "Kaido",
  "aliases": [],
  "ids": {
    "playable": 40,
    "runtime": 48,
    "boss_runtime": 48,
    "model": 48
  },
  "notes": [],
  "assets": {
    "costumes": [
      {
        "id": "default",
        "ref": "costumes/default.json"
      }
    ]
  },
  "movesets": {
    "ref": "movesets.json"
  }
}
